edinet_code,name,syoken_code,security_code
E00004,カネコ種苗株式会社,13760,1376
E00006,株式会社　サカタのタネ,13770,1377
E00007,株式会社雪国まいたけ,13750,1375
E00008,ホクト株式会社,13790,1379
E00009,株式会社アクシーズ,13810,1381
E00010,株式会社ホーブ,13820,1382
E00011,住友林業株式会社,19110,1911
E00012,株式会社　極洋,13010,1301
E00014,株式会社ニッスイ,13320,1332
E00015,マルハニチロ株式会社,13330,1333
E00021,三菱マテリアル株式会社,57110,5711
E00023,住友金属鉱山株式会社,57130,5713
E00024,三井金属鉱業株式会社,57060,5706
E00026,日本精鉱株式会社,57290,5729
E00027,中外鉱業株式会社,14910,1491
E00028,ＤＯＷＡホールディングス株式会社,57140,5714
E00030,日本コークス工業株式会社,33150,3315
E00032,古河機械金属株式会社,57150,5715
E00033,常磐興産株式会社,96750,9675
E00034,太平洋興発株式会社,88350,8835
E00035,株式会社ニッチツ,70210,7021
E00036,日鉄鉱業株式会社,15150,1515
E00037,三井松島ホールディングス株式会社,15180,1518
E00041,石油資源開発株式会社,16620,1662
E00043,株式会社ＩＮＰＥＸ,16050,1605
E00048,大和ハウス工業株式会社,19250,1925
E00052,大成建設株式会社,18010,1801
E00053,清水建設株式会社,18030,1803
E00055,株式会社大林組,18020,1802
E00056,株式会社　熊谷組,18610,1861
E00058,鹿島建設株式会社,18120,1812
E00059,日本国土開発株式会社,18870,1887
E00060,西松建設株式会社,18200,1820
E00063,飛島建設株式会社,18050,1805
E00064,松井建設株式会社,18100,1810
E00065,鉄建建設株式会社,18150,1815
E00066,東亜道路工業株式会社,18820,1882
E00067,日本道路株式会社,18840,1884
E00069,株式会社錢高組,18110,1811
E00073,株式会社中電工,19410,1941
E00074,株式会社関電工,19420,1942
E00075,株式会社きんでん,19440,1944
E00076,株式会社トーエネック,19460,1946
E00079,徳倉建設株式会社,18920,1892
E00080,東亜建設工業株式会社,18850,1885
E00081,若築建設株式会社,18880,1888
E00082,東洋建設株式会社,18900,1890
E00083,株式会社奥村組,18330,1833
E00085,三井住友建設株式会社,18210,1821
E00086,五洋建設株式会社,18930,1893
E00090,株式会社　長谷工コーポレーション,18080,1808
E00091,中央ビルト工業株式会社,19710,1971
E00092,株式会社東京エネシス,19450,1945
E00093,大末建設株式会社,18140,1814
E00094,エクシオグループ株式会社,19510,1951
E00095,大豊建設株式会社,18220,1822
E00097,株式会社不動テトラ,18130,1813
E00098,ライト工業株式会社,19260,1926
E00101,サンユー建設株式会社,18410,1841
E00105,株式会社ナカノフドー建設,18270,1827
E00107,三機工業株式会社,19610,1961
E00109,三晃金属工業株式会社,19720,1972
E00112,東鉄工業株式会社,18350,1835
E00113,太平電業株式会社,19680,1968
E00114,住友電設株式会社,19490,1949
E00115,日本電設工業株式会社,19500,1950
E00117,株式会社イチケン,18470,1847
E00118,南海辰村建設株式会社,18500,1850
E00119,中外炉工業株式会社,19640,1964
E00120,株式会社淺沼組,18520,1852
E00121,佐田建設株式会社,18260,1826
E00130,株式会社　森組,18530,1853
E00133,金下建設株式会社,18970,1897
E00137,株式会社ユアテック,19340,1934
E00138,株式会社ヤマト,19670,1967
E00142,日特建設株式会社,19290,1929
E00143,積水ハウス株式会社,19280,1928
E00146,株式会社九電工,19590,1959
E00147,戸田建設株式会社,18600,1860
E00148,矢作建設工業株式会社,18700,1870
E00149,高砂熱学工業株式会社,19690,1969
E00153,株式会社朝日工業社,19750,1975
E00157,都築電気株式会社,81570,8157
E00161,明星工業株式会社,19760,1976
E00165,株式会社ＲＩＳＥ,88360,8836
E00167,株式会社佐藤渡辺,18070,1807
E00168,日比谷総合設備株式会社,19820,1982
E00173,株式会社サンテック,19600,1960
E00175,北野建設株式会社,18660,1866
E00176,世紀東急工業株式会社,18980,1898
E00179,株式会社植木組,18670,1867
E00181,株式会社四電工,19390,1939
E00182,神田通信機株式会社,19920,1992
E00183,株式会社大気社,19790,1979
E00185,日本リーテック株式会社,19380,1938
E00187,日建工学株式会社,97670,9767
E00189,株式会社協和日成,19810,1981
E00194,ダイダン株式会社,19800,1980
E00196,株式会社福田組,18990,1899
E00197,株式会社日本ハウスホールディングス,18730,1873
E00201,名工建設株式会社,18690,1869
E00204,日本基礎技術株式会社,19140,1914
E00207,北陸電気工事株式会社,19300,1930
E00208,株式会社丹青社,97430,9743
E00209,株式会社　高田工業所,19660,1966
E00210,ＮＥＣネッツエスアイ株式会社,19730,1973
E00218,大東建託株式会社,18780,1878
E00221,新日本建設株式会社,18790,1879
E00222,高橋カーテンウォール工業株式会社,19940,1994
E00225,株式会社テクノ菱和,19650,1965
E00227,新日本空調株式会社,19520,1952
E00232,株式会社テノックス,19050,1905
E00233,大成温調株式会社,19040,1904
E00238,株式会社富士ピー・エス,18480,1848
E00239,株式会社大盛工業,18440,1844
E00240,株式会社土屋ホールディングス,18400,1840
E00242,田辺工業株式会社,18280,1828
E00246,暁飯島工業株式会社,19970,1997
E00248,サイタホールディングス株式会社,19990,1999
E00250,第一建設工業株式会社,17990,1799
E00251,株式会社守谷商会,17980,1798
E00254,株式会社マサル,17950,1795
E00255,株式会社大本組,17930,1793
E00258,株式会社ＥＴＳホールディングス,17890,1789
E00259,株式会社三東工業社,17880,1788
E00260,株式会社ナカボーテック,17870,1787
E00263,株式会社ｆａｎｔａｓｉｓｔａ,17830,1783
E00268,株式会社　ヤマウラ,17800,1780
E00271,川崎設備工業株式会社,17770,1777
E00272,三井住建道路株式会社,17760,1776
E00273,富士古河Ｅ＆Ｃ株式会社,17750,1775
E00276,日本乾溜工業株式会社,17710,1771
E00277,藤田エンジニアリング株式会社,17700,1770
E00279,株式会社ソネック,17680,1768
E00281,東建コーポレーション株式会社,17660,1766
E00282,工藤建設株式会社,17640,1764
E00285,株式会社髙松コンストラクショングループ,17620,1762
E00287,太洋基礎工業株式会社,17580,1758
E00288,株式会社創建エース,17570,1757
E00299,コーアツ工業株式会社,17430,1743
E00302,株式会社メルディアＤＣ,17390,1739
E00304,株式会社　オーテック,17360,1736
E00306,株式会社北弘電社,17340,1734
E00308,麻生フオームクリート株式会社,17300,1730
E00311,株式会社ＡＶＡＮＴＩＡ,89040,8904
E00312,株式会社ビーアールホールディングス,17260,1726
E00313,日本電技株式会社,17230,1723
E00315,美樹工業株式会社,17180,1718
E00316,東急建設株式会社,17200,1720
E00317,株式会社安藤・間,17190,1719
E00320,第一カッター興業株式会社,17160,1716
E00322,コムシスホールディングス株式会社,17210,1721
E00323,株式会社エムビーエス,14010,1401
E00327,株式会社ウエストホールディングス,14070,1407
E00329,ショーボンドホールディングス株式会社,14140,1414
E00331,森永乳業株式会社,22640,2264
E00334,日本ハム株式会社,22820,2282
E00335,プリマハム株式会社,22810,2281
E00337,六甲バター株式会社,22660,2266
E00341,福留ハム株式会社,22910,2291
E00342,エスフーズ株式会社,22920,2292
E00343,滝沢ハム株式会社,22930,2293
E00344,株式会社秋川牧園,13800,1380
E00345,株式会社ニップン,20010,2001
E00346,株式会社日清製粉グループ本社,20020,2002
E00347,日東富士製粉株式会社,20030,2003
E00348,昭和産業株式会社,20040,2004
E00351,鳥越製粉株式会社,20090,2009
E00354,東洋精糖株式会社,21070,2107
E00355,日本甜菜製糖株式会社,21080,2108
E00356,ＤＭ三井製糖ホールディングス株式会社,21090,2109
E00360,フジ日本精糖株式会社,21140,2114
E00361,塩水港精糖株式会社,21120,2112
E00369,森永製菓株式会社,22010,2201
E00371,井村屋グループ株式会社,22090,2209
E00372,株式会社中村屋,22040,2204
E00373,江崎グリコ株式会社,22060,2206
E00374,株式会社不二家,22110,2211
E00375,山崎製パン株式会社,22120,2212
E00376,名糖産業株式会社,22070,2207
E00377,第一屋製パン株式会社,22150,2215
E00378,カンロ株式会社,22160,2216
E00380,株式会社ブルボン,22080,2208
E00381,モロゾフ株式会社,22170,2217
E00382,日糧製パン株式会社,22180,2218
E00385,亀田製菓株式会社,22200,2220
E00386,岩塚製菓株式会社,22210,2221
E00387,寿スピリッツ株式会社,22220,2222
E00388,株式会社コモ,22240,2224
E00389,株式会社湖池屋,22260,2226
E00390,ヒロタグループホールディングス株式会社,33460,3346
E00393,サッポロホールディングス株式会社,25010,2501
E00394,アサヒグループホールディングス株式会社,25020,2502
E00395,キリンホールディングス株式会社,25030,2503
E00396,宝ホールディングス株式会社,25310,2531
E00397,オエノンホールディングス株式会社,25330,2533
E00400,養命酒製造株式会社,25400,2540
E00406,株式会社ヤクルト本社,22670,2267
E00408,北海道コカ・コーラボトリング株式会社,25730,2573
E00414,株式会社伊藤園,25930,2593
E00417,コカ・コーラボトラーズジャパンホールディングス株式会社,25790,2579
E00421,ジャパンフーズ株式会社,25990,2599
E00422,マルサンアイ株式会社,25510,2551
E00424,ダイドーグループホールディングス株式会社,25900,2590
E00428,日清オイリオグループ株式会社,26020,2602
E00431,不二製油グループ本社株式会社,26070,2607
E00433,かどや製油株式会社,26120,2612
E00434,株式会社Ｊ－オイルミルズ,26130,2613
E00435,キッコーマン株式会社,28010,2801
E00436,味の素株式会社,28020,2802
E00439,中部飼料株式会社,20530,2053
E00442,日本食品化工株式会社,28920,2892
E00443,林兼産業株式会社,22860,2286
E00444,カゴメ株式会社,28110,2811
E00446,株式会社ニチレイ,28710,2871
E00447,株式会社セイヒョー,28720,2872
E00448,群栄化学工業株式会社,42290,4229
E00452,ヱスビー食品株式会社,28050,2805
E00453,石井食品株式会社,28940,2894
E00454,日和産業株式会社,20550,2055
E00456,ユアサ・フナショク株式会社,80060,8006
E00457,日清食品ホールディングス株式会社,28970,2897
E00458,丸大食品株式会社,22880,2288
E00461,東洋水産株式会社,28750,2875
E00462,ハウス食品グループ本社株式会社,28100,2810
E00464,キユーピー株式会社,28090,2809
E00465,ユタカフーズ株式会社,28060,2806
E00466,ブルドックソース株式会社,28040,2804
E00469,株式会社永谷園ホールディングス,28990,2899
E00471,石垣食品株式会社,29010,2901
E00472,太陽化学株式会社,29020,2902
E00473,シノブフーズ株式会社,29030,2903
E00474,Ｂ－Ｒ　サーティワン　アイスクリーム株式会社,22680,2268
E00475,焼津水産化学工業株式会社,28120,2812
E00476,一正蒲鉾株式会社,29040,2904
E00478,和弘食品株式会社,28130,2813
E00480,株式会社あじかん,29070,2907
E00481,フジッコ株式会社,29080,2908
E00482,株式会社ロック・フィールド,29100,2910
E00484,佐藤食品工業株式会社,28140,2814
E00486,アリアケジャパン株式会社,28150,2815
E00487,旭松食品株式会社,29110,2911
E00488,株式会社デルソーレ,28760,2876
E00491,キーコーヒー株式会社,25940,2594
E00492,日本たばこ産業株式会社,29140,2914
E00493,ケンコーマヨネーズ株式会社,29150,2915
E00494,仙波糖化工業株式会社,29160,2916
E00495,株式会社大森屋,29170,2917
E00496,わらべや日洋ホールディングス株式会社,29180,2918
E00497,株式会社　マルタイ,29190,2919
E00498,日東ベスト株式会社,28770,2877
E00501,株式会社ダイショー,28160,2816
E00502,株式会社ヒガシマル,20580,2058
E00503,アヲハタ株式会社,28300,2830
E00505,株式会社ユニカフェ,25970,2597
E00506,株式会社なとり,29220,2922
E00508,はごろもフーズ株式会社,28310,2831
E00510,サトウ食品株式会社,29230,2923
E00511,イフジ産業株式会社,29240,2924
E00513,株式会社ピエトロ,28180,2818
E00514,エバラ食品工業株式会社,28190,2819
E00515,株式会社　篠崎屋,29260,2926
E00518,ＲＩＺＡＰグループ株式会社,29280,2928
E00520,グンゼ株式会社,30020,3002
E00521,ポラリス・ホールディングス株式会社,30100,3010
E00523,ヒューリック株式会社,30030,3003
E00524,片倉工業株式会社,30010,3001
E00525,東洋紡株式会社,31010,3101
E00527,ユニチカ株式会社,31030,3103
E00528,倉敷紡績株式会社,31060,3106
E00529,ダイワボウホールディングス株式会社,31070,3107
E00530,シキボウ株式会社,31090,3109
E00531,オーミケンシ株式会社,31110,3111
E00534,サイボー株式会社,31230,3123
E00540,トヨタ紡織株式会社,31160,3116
E00541,株式会社ＵＮＩＶＡ・Ｏａｋホールディングス,31130,3113
E00542,日東紡績株式会社,31100,3110
E00543,富士紡ホールディングス株式会社,31040,3104
E00544,日清紡ホールディングス株式会社,31050,3105
E00545,マーチャント・バンカーズ株式会社,31210,3121
E00547,ダイトウボウ株式会社,32020,3202
E00550,株式会社ダイドーリミテッド,32050,3205
E00552,日本毛織株式会社,32010,3201
E00556,株式会社トーア紡コーポレーション,32040,3204
E00558,日本製麻株式会社,33060,3306
E00559,帝国繊維株式会社,33020,3302
E00562,セーレン株式会社,35690,3569
E00563,東海染工株式会社,35770,3577
E00566,北日本紡績株式会社,34090,3409
E00567,アツギ株式会社,35290,3529
E00569,株式会社ソトー,35710,3571
E00570,ニチモウ株式会社,80910,8091
E00571,株式会社ナイガイ,80130,8013
E00572,イチカワ株式会社,35130,3513
E00573,日本フエルト株式会社,35120,3512
E00574,住江織物株式会社,35010,3501
E00576,エコナックホールディングス株式会社,35210,3521
E00577,芦森工業株式会社,35260,3526
E00578,日東製網株式会社,35240,3524
E00584,オーベクス株式会社,35830,3583
E00585,株式会社バナーズ,30110,3011
E00590,株式会社ワコールホールディングス,35910,3591
E00591,小松マテーレ株式会社,35800,3580
E00593,株式会社三陽商会,80110,8011
E00600,ヤマトインターナショナル株式会社,81270,8127
E00601,株式会社デサント,81140,8114
E00603,株式会社ゴールドウイン,81110,8111
E00604,株式会社ルックホールディングス,80290,8029
E00605,株式会社ラピーヌ,81430,8143
E00607,株式会社自重堂,35970,3597
E00609,ＭＲＫホールディングス株式会社,99800,9980
E00610,株式会社フジックス,36000,3600
E00614,川本産業株式会社,36040,3604
E00617,株式会社クラウディアホールディングス,36070,3607
E00630,株式会社ウッドワン,78980,7898
E00631,永大産業株式会社,78220,7822
E00632,ホクシン株式会社,78970,7897
E00633,セブン工業株式会社,78960,7896
E00635,南海プライウッド株式会社,78870,7887
E00636,株式会社ノダ,78790,7879
E00639,株式会社オービス,78270,7827
E00640,ニホンフラッシュ株式会社,78200,7820
E00642,王子ホールディングス株式会社,38610,3861
E00644,三菱製紙株式会社,38640,3864
E00645,北越コーポレーション株式会社,38650,3865
E00649,中越パルプ工業株式会社,38770,3877
E00650,株式会社巴川コーポレーション,38780,3878
E00652,野崎印刷紙業株式会社,79190,7919
E00659,レンゴー株式会社,39410,3941
E00660,大王製紙株式会社,38800,3880
E00664,古林紙工株式会社,39440,3944
E00667,株式会社リヒトラブ,79750,7975
E00668,ダイナパック株式会社,39470,3947
E00669,株式会社トーモク,39460,3946
E00670,コクヨ株式会社,79840,7984
E00674,ザ・パック株式会社,39500,3950
E00675,スーパーバッグ株式会社,39450,3945
E00677,大石産業株式会社,39430,3943
E00678,ユニ・チャーム株式会社,81130,8113
E00679,ナカバヤシ株式会社,79870,7987
E00681,中央紙器工業株式会社,39520,3952
E00682,大村紙業株式会社,39530,3953
E00685,ニッポン高度紙工業株式会社,38910,3891
E00686,昭和パックス株式会社,39540,3954
E00687,株式会社岡山製紙,38920,3892
E00688,株式会社イムラ,39550,3955
E00690,ハビックス株式会社,38950,3895
E00691,特種東海製紙株式会社,37080,3708
E00692,ＴＯＰＰＡＮホールディングス株式会社,79110,7911
E00693,大日本印刷株式会社,79120,7912
E00695,共同印刷株式会社,79140,7914
E00696,光村印刷株式会社,79160,7916
E00703,ＮＩＳＳＨＡ株式会社,79150,7915
E00705,株式会社ヴィア・ホールディングス,79180,7918
E00707,株式会社学研ホールディングス,94700,9470
E00708,光ビジネスフォーム株式会社,39480,3948
E00709,株式会社文溪堂,94710,9471
E00710,株式会社ＴＡＫＡＲＡ　＆　ＣＯＭＰＡＮＹ,79210,7921
E00711,株式会社光陽社,79460,7946
E00712,三光産業株式会社,79220,7922
E00713,トーイン株式会社,79230,7923
E00714,朝日印刷株式会社,39510,3951
E00715,株式会社マツモト,79010,7901
E00716,株式会社プロネクサス,78930,7893
E00717,株式会社ゼンリン,94740,9474
E00719,サンメッセ株式会社,78830,7883
E00720,竹田ｉＰホールディングス株式会社,78750,7875
E00721,株式会社昭文社ホールディングス,94750,9475
E00722,福島印刷株式会社,78700,7870
E00723,株式会社中央経済社ホールディングス,94760,9476
E00724,株式会社広済堂ホールディングス,78680,7868
E00725,株式会社フジシールインターナショナル,78640,7864
E00728,ＳＥホールディングス・アンド・インキュベーションズ株式会社,94780,9478
E00730,セキ株式会社,78570,7857
E00733,株式会社インプレスホールディングス,94790,9479
E00734,株式会社平賀,78630,7863
E00735,総合商研株式会社,78500,7850
E00736,スターツ出版株式会社,78490,7849
E00744,株式会社　サイネックス,23760,2376
E00745,株式会社ウェッジホールディングス,23880,2388
E00748,株式会社ウイルコホールディングス,78310,7831
E00751,株式会社レゾナック・ホールディングス,40040,4004
E00752,住友化学株式会社,40050,4005
E00755,住友精化株式会社,40080,4008
E00759,日産化学株式会社,40210,4021
E00760,ラサ工業株式会社,40220,4022
E00761,株式会社クレハ,40230,4023
E00762,多木化学株式会社,40250,4025
E00763,神島化学工業株式会社,40260,4026
E00764,テイカ株式会社,40270,4027
E00765,石原産業株式会社,40280,4028
E00766,日本曹達株式会社,40410,4041
E00767,東ソー株式会社,40420,4042
E00768,株式会社トクヤマ,40430,4043
E00769,セントラル硝子株式会社,40440,4044
E00770,東亞合成株式会社,40450,4045
E00771,株式会社大阪ソーダ,40460,4046
E00772,関東電化工業株式会社,40470,4047
E00774,デンカ株式会社,40610,4061
E00775,イビデン株式会社,40620,4062
E00776,信越化学工業株式会社,40630,4063
E00777,日本カーバイド工業株式会社,40640,4064
E00780,堺化学工業株式会社,40780,4078
E00781,高圧ガス工業株式会社,40970,4097
E00783,日本酸素ホールディングス株式会社,40910,4091
E00784,日本化学工業株式会社,40920,4092
E00786,日本化学産業株式会社,40940,4094
E00787,東邦アセチレン株式会社,40930,4093
E00789,片倉コープアグリ株式会社,40310,4031
E00791,丸尾カルシウム株式会社,41020,4102
E00792,エア・ウォーター株式会社,40880,4088
E00794,小池酸素工業株式会社,61370,6137
E00796,チタン工業株式会社,40980,4098
E00804,石原ケミカル株式会社,44620,4462
E00805,ステラケミファ株式会社,41090,4109
E00806,第一稀元素化学工業株式会社,40820,4082
E00808,三菱ケミカルグループ株式会社,41880,4188
E00809,保土谷化学工業株式会社,41120,4112
E00810,田岡化学工業株式会社,41130,4113
E00811,株式会社日本触媒,41140,4114
E00815,三菱瓦斯化学株式会社,41820,4182
E00816,協和キリン株式会社,41510,4151
E00818,株式会社ダイセル,42020,4202
E00819,住友ベークライト株式会社,42030,4203
E00820,積水化学工業株式会社,42040,4204
E00821,日本ゼオン株式会社,42050,4205
E00823,タキロンシーアイ株式会社,42150,4215
E00824,アイカ工業株式会社,42060,4206
E00828,クミアイ化学工業株式会社,49960,4996
E00829,フクビ化学工業株式会社,78710,7871
E00830,旭有機材株式会社,42160,4216
E00832,藤倉化成株式会社,46200,4620
E00834,大倉工業株式会社,42210,4221
E00836,日本化薬株式会社,42720,4272
E00837,広栄化学株式会社,43670,4367
E00838,リケンテクノス株式会社,42200,4220
E00839,児玉化学工業株式会社,42220,4222
E00840,三井化学株式会社,41830,4183
E00841,四国化成ホールディングス株式会社,40990,4099
E00842,戸田工業株式会社,41000,4100
E00845,積水化成品工業株式会社,42280,4228
E00846,オーナンバ株式会社,58160,5816
E00848,有機合成薬品工業株式会社,45310,4531
E00850,細谷火工株式会社,42740,4274
E00852,日本精化株式会社,43620,4362
E00854,東京応化工業株式会社,41860,4186
E00855,大阪有機化学工業株式会社,41870,4187
E00857,天馬株式会社,79580,7958
E00858,株式会社ジェイエスピー,79420,7942
E00860,アグロ　カネショウ株式会社,49550,4955
E00861,前澤化成工業株式会社,79250,7925
E00863,丸東産業株式会社,78940,7894
E00866,三光合成株式会社,78880,7888
E00867,ヤマト・インダストリー株式会社,78860,7886
E00868,ケミプロ化成株式会社,49600,4960
E00871,株式会社タカギセイコー,42420,4242
E00872,帝人株式会社,34010,3401
E00873,東レ株式会社,34020,3402
E00876,株式会社クラレ,34050,3405
E00877,旭化成株式会社,34070,3407
E00878,株式会社ＡＤＥＫＡ,44010,4401
E00879,株式会社カネカ,41180,4118
E00880,日油株式会社,44030,4403
E00881,ミヨシ油脂株式会社,44040,4404
E00882,新日本理化株式会社,44060,4406
E00883,花王株式会社,44520,4452
E00884,三洋化成工業株式会社,44710,4471
E00885,第一工業製薬株式会社,44610,4461
E00886,東邦化学工業株式会社,44090,4409
E00887,日華化学株式会社,44630,4463
E00888,松本油脂製薬株式会社,43650,4365
E00890,株式会社ニイタカ,44650,4465
E00891,大日本塗料株式会社,46110,4611
E00892,日本ペイントホールディングス株式会社,46120,4612
E00893,関西ペイント株式会社,46130,4613
E00895,神東塗料株式会社,46150,4615
E00896,川上塗料株式会社,46160,4616
E00897,中国塗料株式会社,46170,4617
E00898,日本パーカライジング株式会社,40950,4095
E00899,日本ピグメント株式会社,41190,4119
E00900,日本特殊塗料株式会社,46190,4619
E00901,ＤＩＣ株式会社,46310,4631
E00902,大日精化工業株式会社,41160,4116
E00903,ａｒｔｉｅｎｃｅ株式会社,46340,4634
E00904,東京インキ株式会社,46350,4635
E00905,サカタインクス株式会社,46330,4633
E00906,スガイ化学工業株式会社,41200,4120
E00909,株式会社アサヒペン,46230,4623
E00910,イサム塗料株式会社,46240,4624
E00911,アトミクス株式会社,46250,4625
E00912,菊水化学工業株式会社,79530,7953
E00913,太陽ホールディングス株式会社,46260,4626
E00915,ナトコ株式会社,46270,4627
E00916,エスケー化研株式会社,46280,4628
E00917,大伸化学株式会社,46290,4629
E00919,武田薬品工業株式会社,45020,4502
E00920,アステラス製薬株式会社,45030,4503
E00922,住友ファーマ株式会社,45060,4506
E00923,塩野義製薬株式会社,45070,4507
E00926,株式会社テーオーシー,88410,8841
E00928,わかもと製薬株式会社,45120,4512
E00931,日本新薬株式会社,45160,4516
E00932,中外製薬株式会社,45190,4519
E00934,鳥居薬品株式会社,45510,4551
E00935,科研製薬株式会社,45210,4521
E00937,日本農薬株式会社,49970,4997
E00939,エーザイ株式会社,45230,4523
E00941,森下仁丹株式会社,45240,4524
E00942,ロート製薬株式会社,45270,4527
E00944,久光製薬株式会社,45300,4530
E00945,小野薬品工業株式会社,45280,4528
E00947,持田製薬株式会社,45340,4534
E00948,ゼリア新薬工業株式会社,45590,4559
E00949,参天製薬株式会社,45360,4536
E00952,理研ビタミン株式会社,45260,4526
E00953,扶桑薬品工業株式会社,45380,4538
E00957,日本ケミファ株式会社,45390,4539
E00961,栄研化学株式会社,45490,4549
E00962,キッセイ薬品工業株式会社,45470,4547
E00967,Ｈ．Ｕ．グループホールディングス株式会社,45440,4544
E00970,生化学工業株式会社,45480,4548
E00973,ＪＣＲファーマ株式会社,45520,4552
E00974,東和薬品株式会社,45530,4553
E00975,富士製薬工業株式会社,45540,4554
E00977,株式会社カイノス,45560,4556
E00981,そーせいグループ株式会社,45650,4565
E00984,第一三共株式会社,45680,4568
E00985,杏林製薬株式会社,45690,4569
E00986,株式会社免疫生物研究所,45700,4570
