edinet_code,name,syoken_code,security_code
E05399,アルファグループ株式会社,33220,3322
E05400,株式会社セック,37410,3741
E05401,コムシード株式会社,37390,3739
E05403,株式会社アマナ,24020,2402
E05407,株式会社青山財産ネットワークス,89290,8929
E05409,株式会社鉄人化計画,24040,2404
E05410,株式会社博報堂ＤＹホールディングス,24330,2433
E05411,株式会社ツカダ・グローバルホールディング,24180,2418
E05413,サイオス株式会社,37440,3744
E05414,パラカ株式会社,48090,4809
E05416,株式会社ＫＧ情報,24080,2408
E05417,ゲンダイエージェンシー株式会社,24110,2411
E05419,株式会社キャリアデザインセンター,24100,2410
E05422,日本調剤株式会社,33410,3341
E05423,株式会社ベネフィット・ワン,24120,2412
E05424,株式会社インタートレード,37470,3747
E05425,エムスリー株式会社,24130,2413
E05426,みずほリース株式会社,84250,8425
E05428,ヒューマンホールディングス株式会社,24150,2415
E05432,株式会社フライトソリューションズ,37530,3753
E05438,芙蓉総合リース株式会社,84240,8424
E05440,株式会社ケアサービス,24250,2425
E05443,株式会社サイトリ細胞研究所,37500,3750
E05444,株式会社ダイセキ環境ソリューション,17120,1712
E05445,株式会社テクノマセマティカル,37870,3787
E05447,株式会社アウトソーシング,24270,2427
E05449,株式会社ケイブ,37600,3760
E05450,Ｓｈｉｎｗａ　Ｗｉｓｅ　Ｈｏｌｄｉｎｇｓ株式会社,24370,2437
E05452,株式会社ＳＤＳホールディングス,17110,1711
E05453,株式会社アエリア,37580,3758
E05456,株式会社ぐるなび,24400,2440
E05457,株式会社フィスコ,38070,3807
E05458,ウェルネット株式会社,24280,2428
E05460,株式会社ディー・エヌ・エー,24320,2432
E05462,ＮＥＣキャピタルソリューション株式会社,87930,8793
E05463,テクマトリックス株式会社,37620,3762
E05466,株式会社プロシップ,37630,3763
E05467,株式会社ワールドホールディングス,24290,2429
E05469,システムズ・デザイン株式会社,37660,3766
E05470,株式会社エフオン,95140,9514
E05471,リスクモンスター株式会社,37680,3768
E05474,ガンホー・オンライン・エンターテイメント株式会社,37650,3765
E05476,ＧＭＯペイメントゲートウェイ株式会社,37690,3769
E05477,共同ピーアール株式会社,24360,2436
E05478,株式会社シダー,24350,2435
E05480,株式会社インターネットイニシアティブ,37740,3774
E05481,ＲｅＹｕｕ　Ｊａｐａｎ株式会社,94250,9425
E05483,株式会社アスカネット,24380,2438
E05484,株式会社ザッパラス,37700,3770
E05485,株式会社ソフトクリエイトホールディングス,33710,3371
E05487,株式会社システムリサーチ,37710,3771
E05492,フィンテック　グローバル株式会社,87890,8789
E05493,株式会社タカミヤ,24450,2445
E05494,株式会社ブロードバンドタワー,37760,3776
E05496,株式会社アドバンスト・メディア,37730,3773
E05497,株式会社ガイアックス,37750,3775
E05498,株式会社プラップジャパン,24490,2449
E05504,株式会社クロップス,94280,9428
E05505,サンネクスタグループ株式会社,89450,8945
E05509,ジャパンベストレスキューシステム株式会社,24530,2453
E05510,株式会社ＦＨＴホールディングス,37770,3777
E05512,株式会社アイフィスジャパン,78330,7833
E05514,株式会社オールアバウト,24540,2454
E05516,株式会社システム　ディ,38040,3804
E05517,株式会社クリエイト・レストランツ・ホールディングス,33870,3387
E05518,さくらインターネット株式会社,37780,3778
E05521,ＵＬＳグループ株式会社,37980,3798
E05524,株式会社ＡｏｂａーＢＢＴ,24640,2464
E05527,アウンコンサルティング株式会社,24590,2459
E05528,株式会社フォーバル・リアルストレート,94230,9423
E05533,株式会社ファンコミュニケーションズ,24610,2461
E05535,株式会社フュートレック,24680,2468
E05536,ライク株式会社,24620,2462
E05539,スターティアホールディングス株式会社,33930,3393
E05540,株式会社ヴィンクス,37840,3784
E05543,ジェイ・エスコムホールディングス株式会社,37790,3779
E05544,株式会社バルクホールディングス,24670,2467
E05545,ＧＭＯグローバルサイン・ホールディングス株式会社,37880,3788
E05550,ヒビノ株式会社,24690,2469
E05551,株式会社いい生活,37960,3796
E05552,株式会社ドリコム,37930,3793
E05553,キーウェアソリューションズ株式会社,37990,3799
E05555,株式会社エスプール,24710,2471
E05556,株式会社サンマルクホールディングス,33950,3395
E05560,ＷＤＢホールディングス株式会社,24750,2475
E05561,株式会社ユニリタ,38000,3800
E05562,ユナイテッド株式会社,24970,2497
E05563,株式会社ラクーンホールディングス,30310,3031
E05564,手間いらず株式会社,24770,2477
E05569,株式会社ジェイテック,24790,2479
E05570,株式会社エヌジェイホールディングス,94210,9421
E05573,イメージ情報開発株式会社,38030,3803
E05575,システム・ロケーション株式会社,24800,2480
E05576,株式会社タウンニュース社,24810,2481
E05578,株式会社エコミック,38020,3802
E05579,株式会社翻訳センター,24830,2483
E05584,株式会社出前館,24840,2484
E05585,株式会社ティア,24850,2485
E05587,株式会社オウケイウェイヴ,38080,3808
E05592,株式会社ソリトンシステムズ,30400,3040
E05593,ＪＴＰ株式会社,24880,2488
E05597,株式会社ビューティ花壇,30410,3041
E05598,株式会社ＣＤＧ,24870,2487
E05599,株式会社アドウェイズ,24890,2489
E05601,サイバーステップ株式会社,38100,3810
E05606,株式会社セキュアヴェイル,30420,3042
E05607,ファーストブラザーズ株式会社,34540,3454
E05609,株式会社インフォマート,24920,2492
E05611,イーサポートリンク株式会社,24930,2493
E05617,株式会社ＭＩＸＩ,21210,2121
E05621,クルーズ株式会社,21380,2138
E05622,株式会社メディア工房,38150,3815
E05623,株式会社インタースペース,21220,2122
E05624,株式会社ＬＩＦＵＬＬ,21200,2120
E05625,株式会社ジェイエイシーリクルートメント,21240,2124
E05627,株式会社ハイパー,30540,3054
E05629,株式会社日本Ｍ＆Ａセンターホールディングス,21270,2127
E05630,ＴＨＥ　ＷＨＹ　ＨＯＷ　ＤＯ　ＣＯＭＰＡＮＹ株式会社,38230,3823
E05631,日本和装ホールディングス株式会社,24990,2499
E05633,株式会社アルファクス・フード・システム,38140,3814
E05635,株式会社大和コンピューター,38160,3816
E05640,株式会社ＳＲＡホールディングス,38170,3817
E05641,メディアファイブ株式会社,38240,3824
E05643,株式会社システムインテグレータ,38260,3826
E05645,株式会社リミックスポイント,38250,3825
E05646,株式会社オリエンタルコンサルタンツホールディングス,24980,2498
E05647,ソースネクスト株式会社,43440,4344
E05648,株式会社アドバンテッジリスクマネジメント,87690,8769
E05650,株式会社ギガプライズ,38300,3830
E05651,株式会社イントランス,32370,3237
E05657,株式会社ヒップ,21360,2136
E05659,ｅＢＡＳＥ株式会社,38350,3835
E05663,株式会社アバントグループ,38360,3836
E05664,アドソル日進株式会社,38370,3837
E05665,イー・ギャランティ株式会社,87710,8771
E05668,株式会社中広,21390,2139
E05669,株式会社ジーダット,38410,3841
E05670,株式会社光ハイツ・ヴェラス,21370,2137
E05673,株式会社ＤＤグループ,30730,3073
E05674,パス株式会社,38400,3840
E05676,ｎｍｓホールディングス株式会社,21620,2162
E05677,株式会社ネクストジェン,38420,3842
E05678,コムチュア株式会社,38440,3844
E05679,株式会社ＯＤＫソリューションズ,38390,3839
E05680,フリービット株式会社,38430,3843
E05682,株式会社アイフリークモバイル,38450,3845
E05684,株式会社ケアネット,21500,2150
E05686,アイティメディア株式会社,21480,2148
E05687,パシフィックシステム株式会社,38470,3847
E05688,株式会社データ・アプリケーション,38480,3848
E05690,日本テクノ・ラボ株式会社,38490,3849
E05691,幼児活動研究会株式会社,21520,2152
E05692,地主株式会社,32520,3252
E05694,株式会社エヌ・ティ・ティ・データ・イントラマート,38500,3850
E05695,株式会社オープンアップグループ,21540,2154
E05697,株式会社エス・エム・エス,21750,2175
E05698,ＵＴグループ株式会社,21460,2146
E05699,アステリア株式会社,38530,3853
E05700,株式会社ＦＲＯＮＴＥＯ,21580,2158
E05701,セーラー広告株式会社,21560,2156
E05702,株式会社ネクスグループ,66340,6634
E05703,サイバーコム株式会社,38520,3852
E05705,株式会社アイル,38540,3854
E05706,Ｅ・Ｊホールディングス株式会社,21530,2153
E05707,アクセルマーク株式会社,36240,3624
E05712,株式会社ジーエヌアイグループ,21600,2160
E05713,Ａｂａｌａｎｃｅ株式会社,38560,3856
E05716,株式会社地域新聞社,21640,2164
E05717,株式会社アルトナー,21630,2163
E05719,株式会社ユビキタスＡＩ,38580,3858
E05720,株式会社ラック,38570,3857
E05725,株式会社ＺＯＺＯ,30920,3092
E05726,ＣＤＳ株式会社,21690,2169
E05727,株式会社リンクアンドモチベーション,21700,2170
E05728,ＮＡＮＯ　ＭＲＮＡ株式会社,45710,4571
E05729,株式会社パソナグループ,21680,2168
E05736,ネットイヤーグループ株式会社,36220,3622
E05737,株式会社博展,21730,2173
E05739,ＴＩＳ株式会社,36260,3626
E05740,株式会社インサイト,21720,2172
E05741,ビリングシステム株式会社,36230,3623
E05742,テックファームホールディングス株式会社,36250,3625
E05821,ワイ・ティー・エル・コーポレーション・バーハッド,17730,1773
E05951,ビート・ホールディングス・リミテッド　（貝德控股有限公司、Ｂｅａｔ　Ｈｏｌｄｉｎｇｓ　Ｌｉｍｉｔｅｄ）,93990,9399
E05958,メディシノバ・インク,48750,4875
E06141,第一生命ホールディングス株式会社,87500,8750
E07801,株式会社リクルートホールディングス,60980,6098
E09753,全国保証株式会社,71640,7164
E10737,株式会社クスリのアオキホールディングス,35490,3549
E11661,フリュー株式会社,62380,6238
E11873,日本製紙株式会社,38630,3863
E20385,テクミラホールディングス株式会社,36270,3627
E20616,株式会社ティーケーピー,34790,3479
E20870,株式会社ＭＳ＆Ｃｏｎｓｕｌｔｉｎｇ,65550,6555
E21035,ウエルシアホールディングス株式会社,31410,3141
E21122,株式会社オークネット,39640,3964
E21183,大塚ホールディングス株式会社,45780,4578
E21187,ＡＲＥホールディングス株式会社,58570,5857
E21258,株式会社やまびこ,62500,6250
E21259,ＢＲＵＮＯ株式会社,31400,3140
E21261,パーソルホールディングス株式会社,21810,2181
E21320,株式会社ＪＶＣケンウッド,66320,6632
E21342,住石ホールディングス株式会社,15140,1514
E21381,株式会社サニーサイドアップグループ,21800,2180
E21391,株式会社アスコット,32640,3264
E21514,株式会社成学社,21790,2179
E21553,株式会社データホライゾン,36280,3628
E21606,株式会社クリエイトＳＤホールディングス,31480,3148
E21649,株式会社アサカ理研,57240,5724
E21671,レオス・キャピタルワークス株式会社,73300,7330
E21706,株式会社リニカル,21830,2183
E21799,内外トランスライン株式会社,93840,9384
E21815,株式会社ショーエイコーポレーション,93850,9385
E21832,オーウイル株式会社,31430,3143
E21902,明治ホールディングス株式会社,22690,2269
E21955,川田テクノロジーズ株式会社,34430,3443
E22007,株式会社ＣＡＲＴＡ　ＨＯＬＤＩＮＧＳ,36880,3688
E22012,グリー株式会社,36320,3632
E22016,株式会社菊池製作所,34440,3444
E22024,株式会社デ・ウエスタン・セラピテクス研究所,45760,4576
E22042,株式会社シイエム・シイ,21850,2185
E22049,ソーバル株式会社,21860,2186
E22101,ＧＭＯペパボ株式会社,36330,3633
E22440,株式会社バイタルケーエスケー・ホールディングス,31510,3151
E22460,株式会社コーエーテクモホールディングス,36350,3635
E22461,株式会社ソケッツ,36340,3634
E22470,株式会社バリューＨＲ,60780,6078
E22509,大研医器株式会社,77750,7775
E22547,株式会社グリムス,31500,3150
E22554,株式会社小田原機器,73140,7314
E22560,大幸薬品株式会社,45740,4574
E22612,株式会社ファンドクリエーショングループ,32660,3266
E22663,クックパッド株式会社,21930,2193
E22995,メディアスホールディングス株式会社,31540,3154
E23187,フィデアホールディングス株式会社,87130,8713
E23202,雪印メグミルク株式会社,22700,2270
E23245,株式会社レスターホールディングス,31560,3156
E23250,株式会社池田泉州ホールディングス,87140,8714
E23288,ジオリーブグループ株式会社,31570,3157
E23465,粧美堂株式会社,78190,7819
E23479,株式会社シーボン,49260,4926
E23487,株式会社キャンバス,45750,4575
E23492,株式会社三菱総合研究所,36360,3636
E23634,アミタホールディングス株式会社,21950,2195
E23741,シンデン・ハイテックス株式会社,31310,3131
E23818,チムニー株式会社,31780,3178
E23820,トモニホールディングス株式会社,86000,8600
E23829,ヤーマン株式会社,66300,6630
E23841,丸善ＣＨＩホールディングス株式会社,31590,3159
E23871,テクノホライゾン株式会社,66290,6629
E23924,ＳＯＭＰＯホールディングス株式会社,86300,8630
E24017,株式会社エスクリ,21960,2196
E24050,ＥＮＥＯＳホールディングス株式会社,50200,5020
E24073,アニコム　ホールディングス株式会社,87150,8715
E24129,株式会社大光,31600,3160
E24158,株式会社セルシード,77760,7776
E24187,ダイト株式会社,45770,4577
E24248,アゼアス株式会社,31610,3161
E24340,株式会社　ＴＨＥグローバル社,32710,3271
E24392,株式会社ボルテージ,36390,3639
E24453,株式会社パピレス,36410,3641
E24457,株式会社電算,36400,3640
E24465,全研本社株式会社,73710,7371
E24512,インターライフホールディングス株式会社,14180,1418
E24536,ＯＣＨＩホールディングス株式会社,31660,3166
E24545,株式会社テレビ東京ホールディングス,94130,9413
E24550,アイ・ケイ・ケイホールディングス株式会社,21980,2198
E24558,株式会社ミライト・ワン,14170,1417
E24651,株式会社ＦＰＧ,71480,7148
E24682,シンバイオ製薬株式会社,45820,4582
E24753,株式会社トランザクション,78180,7818
E24917,イー・ガーディアン株式会社,60500,6050
E24951,株式会社ポーラ・オルビスホールディングス,49270,4927
E24982,株式会社メディカルネット,36450,3645
E24991,株式会社ノエビアホールディングス,49280,4928
E24994,株式会社テラプローブ,66270,6627
E24998,株式会社ジー・スリーホールディングス,36470,3647
E25148,株式会社ジェイ・エス・ビー,34800,3480
E25156,インテグラル株式会社,58420,5842
E25165,株式会社ＴＯＫＡＩホールディングス,31670,3167
E25169,株式会社ゲームカード・ジョイコホールディングス,62490,6249
E25206,株式会社駅探,36460,3646
E25234,株式会社ＴＳＩホールディングス,36080,3608
E25263,ＡＧＳ株式会社,36480,3648
E25269,ラクオリア創薬株式会社,45790,4579
E25282,日本ドライケミカル株式会社,19090,1909
E25283,株式会社ファインデックス,36490,3649
E25303,カルビー株式会社,22290,2229
E25386,ＳＥＭＩＴＥＣ株式会社,66260,6626
E25443,黒谷株式会社,31680,3168
E25551,株式会社イートアンドホールディングス,28820,2882
E25620,株式会社ディジタルメディアプロフェッショナル,36520,3652
E25621,ハウスコム株式会社,32750,3275
E25648,ウェルネオシュガー株式会社,21170,2117
E25662,サノヤスホールディングス株式会社,70220,7022
E25664,パラマウントベッドホールディングス株式会社,78170,7817
E25665,宮越ホールディングス株式会社,66200,6620
E25678,大正製薬ホールディングス株式会社,45810,4581
E25682,株式会社モルフォ,36530,3653
E25686,ＪＡＬＣＯホールディングス株式会社,66250,6625
E25817,株式会社ブレインパッド,36550,3655
E25850,株式会社ネクソン,36590,3659
E25867,ＫＬａｂ株式会社,36560,3656
E25870,株式会社ＪＰＭＣ,32760,3276
E25884,株式会社スリー・ディー・マトリックス,77770,7777
E25898,ポールトゥウィンホールディングス株式会社,36570,3657
E25969,ベルグアース株式会社,13830,1383
E26032,株式会社リブセンス,60540,6054
E26061,新田ゼラチン株式会社,49770,4977
E26082,ダブル・スコープ株式会社,66190,6619
E26084,株式会社スターフライヤー,92060,9206
E26086,株式会社サンセイランディック,32770,3277
E26095,株式会社ミサワ,31690,3169
E26096,株式会社カイオム・バイオサイエンス,45830,4583
E26124,ジャパンマテリアル株式会社,60550,6055
E26216,株式会社大泉製作所,66180,6618
E26231,株式会社セルシス,36630,3663
E26290,株式会社Ｃｏｍｉｎｉｘ,31730,3173
E26301,株式会社アイスタイル,36600,3660
E26322,ティーライフ株式会社,31720,3172
E26327,ライフネット生命保険株式会社,71570,7157
E26332,株式会社エムアップホールディングス,36610,3661
E26369,株式会社エイチーム,36620,3662
E26428,株式会社ベクトル,60580,6058
E26443,こころネット株式会社,60600,6060
E26444,株式会社チャーム・ケア・コーポレーション,60620,6062
E26446,株式会社ユニバーサル園芸社,60610,6061
E26454,株式会社ウチヤマホールディングス,60590,6059
E26549,株式会社北の達人コーポレーション,29300,2930
E26579,株式会社ハピネス・アンド・ディ,31740,3174
E26596,株式会社モブキャストホールディングス,36640,3664
E26625,日本エマージェンシーアシスタンス株式会社,60630,6063
E26675,株式会社ワイヤレスゲート,94190,9419
E26686,株式会社じもとホールディングス,71610,7161
E26703,株式会社エニグモ,36650,3665
E26707,日本軽金属ホールディングス株式会社,57030,5703
E26713,株式会社東光高岳,66170,6617
E26813,アストマックス株式会社,71620,7162
E26815,ＧＭＯフィナンシャルホールディングス株式会社,71770,7177
E26821,株式会社ありがとうサービス,31770,3177
E26831,三協立山株式会社,59320,5932
E26839,キャリアリンク株式会社,60700,6070
E26842,株式会社エー・ピーホールディングス,31750,3175
E26869,日本コンセプト株式会社,93860,9386
E26914,阿波製紙株式会社,38960,3896
E26933,トレンダーズ株式会社,60690,6069
E26966,株式会社エストラスト,32800,3280
E26990,住信ＳＢＩネット銀行株式会社,71630,7163
E27016,株式会社アジュバンホールディングス,49290,4929
E27032,キッズウェル・バイオ株式会社,45840,4584
E27043,株式会社アビスト,60870,6087
E27046,株式会社グランディーズ,32610,3261
E27047,株式会社ｅｎｉｓｈ,36670,3667
E27050,株式会社テクノスジャパン,36660,3666
E27051,シュッピン株式会社,31790,3179
E27054,株式会社ユーグレナ,29310,2931
E27059,地盤ネットホールディングス株式会社,60720,6072
E27062,株式会社コロプラ,36680,3668
E27063,パンチ工業株式会社,61650,6165
E27066,株式会社ＩＢＪ,60710,6071
E27202,株式会社買取王国,31810,3181
E27208,株式会社メドレックス,45860,4586
E27210,ウイン・パートナーズ株式会社,31830,3183
E27215,株式会社ビューティガレージ,31800,3180
E27235,協立情報通信株式会社,36700,3670
E27260,オイシックス・ラ・大地株式会社,31820,3182
E27273,サンヨーホームズ株式会社,14200,1420
E27276,ソフトマックス株式会社,36710,3671
E27280,株式会社オルトプラス,36720,3672
E27281,株式会社フージャースホールディングス,32840,3284
E27294,株式会社プレミアムウォーターホールディングス,25880,2588
E27303,株式会社アサンテ,60730,6073
E27305,タマホーム株式会社,14190,1419
E27361,株式会社ブロードリーフ,36730,3673
E27394,株式会社オークファン,36740,3674
E27421,株式会社クロス・マーケティンググループ,36750,3675
E27464,トラストホールディングス株式会社,32860,3286
E27486,ペプチドリーム株式会社,45870,4587
E27506,株式会社ジェイエスエス,60740,6074
E27530,株式会社横田製作所,62480,6248
E27572,ＩＣＤＡホールディングス株式会社,31840,3184
E27585,株式会社リプロセル,49780,4978
E27615,夢展望株式会社,31850,3185
E27622,サントリー食品インターナショナル株式会社,25870,2587
E27624,カーリットホールディングス株式会社,42750,4275
E27633,東急不動産ホールディングス株式会社,32890,3289
E27655,株式会社デジタルハーツホールディングス,36760,3676
E27671,株式会社ＩＪＴＴ,73150,7315
E27693,株式会社ネクステージ,31860,3186
E27759,飯田グループホールディングス株式会社,32910,3291
E27761,株式会社アメイズ,60760,6076
E27815,株式会社サンワカンパニー,31870,3187
E27842,株式会社オープンハウスグループ,32880,3288
E27855,ＥＲＩホールディングス株式会社,60830,6083
E27868,株式会社エンビプロ・ホールディングス,56980,5698
E27877,株式会社システム情報,36770,3677
E27894,株式会社ショーケース,39090,3909
E30002,株式会社メディアドゥ,36780,3678
E30010,株式会社ビジョン,94160,9416
E30020,株式会社ＡＮＡＰ,31890,3189
E30022,Ｍ＆Ａキャピタルパートナーズ株式会社,60800,6080
E30042,株式会社ウエスコホールディングス,60910,6091
E30047,株式会社じげん,36790,3679
E30048,Ｋ＆Ｏエナジーグループ株式会社,16630,1663
E30053,アライドアーキテクツ株式会社,60810,6081
E30058,オンコリスバイオファーマ株式会社,45880,4588
E30065,株式会社ライドオンエクスプレスホールディングス,60820,6082
E30066,アズマハウス株式会社,32930,3293
E30071,ヒューマン・メタボローム・テクノロジーズ株式会社,60900,6090
E30085,エンカレッジ・テクノロジ株式会社,36820,3682
E30091,株式会社ホットリンク,36800,3680
E30103,株式会社めぶきフィナンシャルグループ,71670,7167
E30114,株式会社ブイキューブ,36810,3681
E30118,ＣＹＢＥＲＤＹＮＥ株式会社,77790,7779
E30119,アーキテクツ・スタジオ・ジャパン株式会社,60850,6085
E30120,シンメンテホールディングス株式会社,60860,6086
E30124,株式会社イーグランド,32940,3294
E30126,株式会社日本アクア,14290,1429
E30130,株式会社シグマクシス・ホールディングス,60880,6088
E30133,株式会社ダイキアクシス,42450,4245
E30140,株式会社ウィルグループ,60890,6089
E30398,株式会社サイバーリンクス,36830,3683
E30438,ダイキョーニシカワ株式会社,42460,4246
E30443,ＡＺ－ＣＯＭ丸和ホールディングス株式会社,90900,9090
E30445,株式会社エンバイオ・ホールディングス,60920,6092
E30451,株式会社ホットマン,31900,3190
E30454,日本ＢＳ放送株式会社,94140,9414
E30466,株式会社ディー・エル・イー,36860,3686
E30476,株式会社エスクロー・エージェント・ジャパン,60930,6093
E30479,トレックス・セミコンダクター株式会社,66160,6616
E30481,株式会社ジャパンディスプレイ,67400,6740
E30501,株式会社ジョイフル本田,31910,3191
E30504,株式会社白鳩,31920,3192
E30537,株式会社フィックスターズ,36870,3687
E30598,株式会社東武住販,32970,3297
E30648,株式会社フリークアウト・ホールディングス,60940,6094
E30649,株式会社ムゲンエステート,32990,3299
E30650,メドピア株式会社,60950,6095
E30656,株式会社ヨシックスホールディングス,32210,3221
E30682,株式会社レアジョブ,60960,6096
E30692,ポバール興業株式会社,42470,4247
E30697,ＯＡＴアグリオ株式会社,49790,4979
E30699,株式会社鳥貴族ホールディングス,31930,3193
E30726,株式会社グッドコムアセット,34750,3475
E30728,フィード・ワン株式会社,20600,2060
E30731,株式会社ＫＡＤＯＫＡＷＡ,94680,9468
E30746,株式会社東京きらぼしフィナンシャルグループ,71730,7173
E30836,株式会社イルグルム,36900,3690
E30841,株式会社ジャパンインベストメントアドバイザー,71720,7172
E30856,株式会社デジタルプラス,36910,3691
E30857,ＧＭＯリサーチ株式会社,36950,3695
E30865,株式会社リボミック,45910,4591
E30877,株式会社ＦＦＲＩセキュリティ,36920,3692
E30880,株式会社アンビションＤＸホールディングス,33000,3300
